{
  "schemaVersion": 2,
  "status": "finalized",
  "finalizedAt": "2026-04-03",
  "ideaId": "idea-render-persistence-fixture",
  "projectName": "Render Persistence Fixture",
  "owner": "Test User",
  "purpose": "Render development docs from a finalized state that uses persistence.",
  "projectType": "CLI",
  "techStack": {
    "language": "Python",
    "runtime": "Python 3.12",
    "framework": "None",
    "packageTool": "None"
  },
  "persistence": "SQLite",
  "authentication": "None",
  "determinism": "High",
  "packaging": "None",
  "constraints": "Keep persistence guidance explicit and migration-ready.",
  "commands": {
    "build": "python3 -m py_compile scripts/python/cli.py scripts/python/template_cli/*.py",
    "run": "./scripts/render-development-docs",
    "test": "./scripts/validate-development"
  },
  "product": {
    "problemStatement": "Development-mode rendering should cover persistence-enabled projects too.",
    "targetUsers": "Template maintainers",
    "whyNow": "The migration-policy branch should be protected by regression tests.",
    "expectedValue": "Persistent projects render the right docs and keep `.gitignore` stable.",
    "solutionSummary": "Use a finalized-state fixture with SQLite persistence to test migration-policy rendering.",
    "mvpScope": "Render development docs and validate the persistence-specific outputs.",
    "outOfScope": "Running a real database.",
    "assumptions": "The development templates already include database ignore patterns.",
    "nonGoals": "Duplicate ignore rules during repeated renders."
  },
  "governance": {
    "keyDecisions": "Treat persistence as a first-class render branch with dedicated regression coverage.",
    "topRisks": "Migration policy output or `.gitignore` drift silently when persistence is enabled.",
    "mitigationPlans": "Keep a persistence-enabled fixture in the main render test suite.",
    "contingencies": "Refresh the fixture when persistence rules evolve intentionally.",
    "remainingAcceptedRisks": "Template wording may still evolve over time.",
    "latestReviewOutcome": "pass",
    "latestReviewSession": "sessions/2026-04-03_idea-render-persistence-fixture.md"
  },
  "artifacts": {
    "ideaFiles": [],
    "sessionFiles": [
      "sessions/2026-04-03_idea-render-persistence-fixture.md"
    ],
    "noteReferences": "None recorded",
    "summaryExport": "",
    "finalizationSession": "sessions/2026-04-03_FINALIZATION_SESSION_idea-render-persistence-fixture.md",
    "adrReferences": [
      "docs/adr/ADR-0001-record-architecture-decisions.md"
    ]
  }
}
